{
  "id": "essentialism",
  "title": "에센셜리즘",
  "subtitle": "본질에 집중하는 힘",
  "author": "그렉 맥커운",
  "publisher": "알에이치코리아",
  "publishedYear": 2014,
  "isbn": "9788925553375",
  "category": "self-improvement",
  "tags": ["선택", "우선순위", "에너지", "단순화"],
  "difficulty": "beginner",
  "estimatedReadMinutes": 10,
  "curatorScore": 87,
  "oneLine": "덜어낼 일을 정해야 중요한 삶이 남는다는 선택의 책",
  "whyRead": "중년 이후의 성장은 더 많은 일을 추가하는 방식보다 에너지를 지키는 방식에서 시작된다. 이 책은 거절과 선택을 삶의 기술로 다룬다.",
  "summary": [
    "에센셜리즘은 많은 일을 잘하는 태도가 아니라 정말 중요한 일을 선별하는 태도다.",
    "분명한 예가 아니라면 아니라고 말할 수 있어야 에너지가 보존된다.",
    "바쁜 상태를 성실함과 혼동하지 않도록 도와준다.",
    "삶의 기준을 정하면 관계, 일, 소비, 일정의 노이즈가 줄어든다."
  ],
  "keyQuotes": [
    "선택하지 않는 삶은 결국 다른 사람의 우선순위로 채워진다.",
    "에너지를 아끼는 것은 소극적인 태도가 아니라 중요한 일을 남기기 위한 전략이다."
  ],
  "curatorNote": "이번 주 캘린더에서 '하지 않아도 되는 약속' 하나를 골라보세요. 이 책은 그 결정을 정당화해줍니다.",
  "recommendedFor": ["거절이 어려운 사람", "해야 할 일이 늘어 지친 사람", "삶을 단순하게 재정렬하고 싶은 사람"],
  "relatedBookIds": ["the-one-thing", "four-thousand-weeks"],
  "markdownPath": "markdown/essentialism.md",
  "createdAt": "2026-06-13T09:50:00+09:00",
  "updatedAt": "2026-06-13T09:50:00+09:00"
}
