{
  "id": "dignity-of-work",
  "title": "일의 격",
  "subtitle": "성장하는 나, 성공하는 조직, 성숙한 삶",
  "author": "신수정",
  "publisher": "턴어라운드",
  "publishedYear": 2021,
  "isbn": "9791190276023",
  "category": "career",
  "tags": ["커리어", "일", "성장", "리더십"],
  "difficulty": "beginner",
  "estimatedReadMinutes": 10,
  "curatorScore": 86,
  "oneLine": "일의 기술보다 일을 대하는 품격을 정리하게 하는 책",
  "whyRead": "40대 이후의 일은 성과만이 아니라 영향, 태도, 성숙함으로 평가된다. 이 책은 직장 생활의 경험을 성장의 언어로 정리해준다.",
  "summary": [
    "일을 잘한다는 것은 결과뿐 아니라 관계, 태도, 학습 방식까지 포함한다.",
    "경력의 깊이는 반복된 업무에서 어떤 의미와 기준을 뽑아내는가에 달려 있다.",
    "리더십과 팔로워십을 모두 현실적인 문장으로 다룬다.",
    "일의 성공을 개인의 성숙과 연결해 보게 한다."
  ],
  "keyQuotes": [
    "일의 수준은 능력만큼이나 태도와 기준에서 드러난다.",
    "경력은 시간이 아니라 경험을 해석하는 힘으로 깊어진다."
  ],
  "curatorNote": "직장에서 지친 날 읽으면 '나는 어떤 사람으로 일하고 싶은가'를 다시 묻게 됩니다.",
  "recommendedFor": ["경력의 다음 단계를 고민하는 사람", "리더십과 성숙함을 함께 키우고 싶은 사람", "일의 의미가 흐려진 사람"],
  "relatedBookIds": ["deep-work", "range"],
  "markdownPath": "markdown/dignity-of-work.md",
  "createdAt": "2026-06-13T09:50:00+09:00",
  "updatedAt": "2026-06-13T09:50:00+09:00"
}
