{
  "id": "deep-work",
  "title": "딥 워크",
  "subtitle": "강렬한 몰입, 최고의 성과",
  "author": "칼 뉴포트",
  "publisher": "민음사",
  "publishedYear": 2017,
  "isbn": "9788937434082",
  "category": "career",
  "tags": ["업무", "몰입", "생산성", "디지털"],
  "difficulty": "intermediate",
  "estimatedReadMinutes": 11,
  "curatorScore": 89,
  "oneLine": "산만함이 기본값이 된 시대에 깊이 일하는 법을 되찾는 책",
  "whyRead": "40대 업무 리듬은 속도보다 깊이에서 차이가 난다. 얕은 반응 업무와 깊은 성과 업무를 구분하게 해준다.",
  "summary": [
    "집중력은 타고난 성향이 아니라 훈련하고 보호해야 하는 업무 자산이다.",
    "알림, 회의, 메신저가 성과를 낸다는 착각을 점검하게 한다.",
    "깊은 일의 시간을 확보하려면 일정, 환경, 규칙을 함께 설계해야 한다.",
    "일의 질은 얼마나 오래 앉아 있었는가보다 방해 없는 집중의 밀도에 좌우된다."
  ],
  "keyQuotes": [
    "몰입은 바쁜 하루 안에 우연히 생기지 않는다.",
    "깊은 일은 실력과 결과를 동시에 키우는 훈련장이다."
  ],
  "curatorNote": "하루에 60분만 알림을 끄고 한 문제를 붙잡아보세요. 이 책의 효과는 읽는 순간보다 실행한 날에 더 크게 옵니다.",
  "recommendedFor": ["회의와 알림에 하루가 흩어지는 사람", "전문성을 다시 끌어올리고 싶은 사람", "집중 가능한 업무 루틴이 필요한 사람"],
  "relatedBookIds": ["the-one-thing", "essentialism"],
  "markdownPath": "markdown/deep-work.md",
  "createdAt": "2026-06-13T09:50:00+09:00",
  "updatedAt": "2026-06-13T09:50:00+09:00"
}
