{
  "id": "exercise-brain-science",
  "title": "운동의 뇌과학",
  "subtitle": "불안장애에 시달린 뇌과학자가 발견한 7가지 운동의 힘",
  "author": "제니퍼 헤이스",
  "publisher": "현대지성",
  "publishedYear": 2023,
  "isbn": "9791139716009",
  "category": "health",
  "tags": ["운동", "뇌과학", "기분", "스트레스"],
  "difficulty": "intermediate",
  "estimatedReadMinutes": 11,
  "curatorScore": 87,
  "oneLine": "운동을 의지가 아니라 뇌와 마음을 회복하는 도구로 보게 하는 책",
  "whyRead": "나이가 들수록 운동은 몸매 관리가 아니라 기분, 수면, 집중력의 기반이 된다. 이 책은 운동의 효과를 뇌과학 관점에서 납득시킨다.",
  "summary": [
    "운동은 우울, 불안, 스트레스, 수면, 집중력과 깊게 연결된다.",
    "운동을 잘하는 사람만의 이야기가 아니라 작게 시작하는 방법을 다룬다.",
    "뇌 건강을 위해 필요한 움직임의 의미를 과학적으로 설명한다.",
    "운동을 미루던 사람에게 실천의 명분을 준다."
  ],
  "keyQuotes": [
    "움직임은 몸을 쓰는 일이면서 동시에 뇌를 돌보는 일이다.",
    "기분을 바꾸고 싶을 때 가장 가까운 도구는 몸을 움직이는 것이다."
  ],
  "curatorNote": "운동 습관을 만들고 싶다면 이 책과 함께 10분 걷기부터 시작하면 좋습니다.",
  "recommendedFor": ["스트레스와 기분 저하를 운동으로 다루고 싶은 사람", "운동의 과학적 이유가 필요한 사람", "수면과 집중력을 회복하고 싶은 사람"],
  "relatedBookIds": ["built-to-move", "outlive"],
  "markdownPath": "markdown/exercise-brain-science.md",
  "createdAt": "2026-06-13T09:50:00+09:00",
  "updatedAt": "2026-06-13T09:50:00+09:00"
}
