{
  "id": "outlive",
  "title": "질병 해방",
  "subtitle": "아웃라이브: 노화와 질병에 맞서는 건강 수명 과학",
  "author": "피터 아티아, 빌 기퍼드",
  "publisher": "부키",
  "publishedYear": 2024,
  "isbn": "9791193528129",
  "category": "health",
  "tags": ["건강", "장수", "수면", "운동"],
  "difficulty": "advanced",
  "estimatedReadMinutes": 13,
  "curatorScore": 89,
  "oneLine": "오래 사는 것보다 오래 건강하게 사는 법을 묻는 책",
  "whyRead": "40대 건강 관리는 문제가 생긴 뒤 고치는 방식에서 미리 설계하는 방식으로 넘어가야 한다. 이 책은 운동, 대사, 수면, 예방의 관점을 넓혀준다.",
  "summary": [
    "수명보다 건강수명에 초점을 맞추며 예방 중심의 사고를 강조한다.",
    "운동, 영양, 수면, 정서 건강을 장기 전략으로 연결한다.",
    "검사 수치 하나보다 삶 전체의 리스크 관리가 중요하다고 본다.",
    "건강을 단기 다이어트가 아니라 앞으로 수십 년의 기반으로 다룬다."
  ],
  "keyQuotes": [
    "건강은 문제가 생긴 뒤 수리하는 대상이 아니라 미리 설계해야 할 시스템이다.",
    "오래 사는 목표는 오래 움직이고 선택할 수 있는 삶과 함께 가야 한다."
  ],
  "curatorNote": "분량과 깊이가 있는 책입니다. 처음에는 운동, 수면, 대사 관련 장부터 골라 읽어도 좋습니다.",
  "recommendedFor": ["건강 검진 이후 생활을 바꾸고 싶은 사람", "장기 건강 전략이 필요한 사람", "운동과 수면의 우선순위를 높이고 싶은 사람"],
  "relatedBookIds": ["built-to-move", "exercise-brain-science"],
  "markdownPath": "markdown/outlive.md",
  "createdAt": "2026-06-13T09:50:00+09:00",
  "updatedAt": "2026-06-13T09:50:00+09:00"
}
