{
  "id": "as-a-man-thinketh",
  "title": "원인과 결과의 법칙",
  "subtitle": "사람은 생각하는 대로 살게 된다",
  "author": "제임스 앨런",
  "publisher": "21세기북스",
  "publishedYear": 2024,
  "isbn": "9791171177660",
  "category": "humanities",
  "tags": ["생각", "철학", "자기성찰", "태도", "성공철학"],
  "difficulty": "intermediate",
  "estimatedReadMinutes": 13,
  "curatorScore": 87,
  "oneLine": "삶의 결과를 바꾸려면 먼저 반복해서 품는 생각을 보라는 짧고 강한 고전",
  "whyRead": "이 책은 자기계발의 기술보다 태도의 뿌리에 가깝다. 환경을 탓하기 전에 내 생각의 반복 패턴이 어떤 선택을 만들고 있는지 점검하게 한다.",
  "summary": [
    "생각은 순간의 기분이 아니라 반복될수록 성격과 행동의 방향이 된다.",
    "결과는 우연처럼 보일 때도 있지만, 그 아래에는 오래 누적된 태도가 있다.",
    "자기 성찰은 자책이 아니라 원인을 찾는 일이다.",
    "높은 목표는 먼저 그 목표를 감당할 만한 내면의 질서를 요구한다."
  ],
  "keyQuotes": [
    "생각은 습관이 되고, 습관은 삶이 따라 걷는 길이 된다.",
    "결과를 바꾸고 싶다면 먼저 반복해서 품는 생각을 살펴야 한다."
  ],
  "curatorNote": "분량은 짧지만 메시지는 직선적입니다. 모든 일을 마음가짐 탓으로 돌리면 위험하지만, 내가 통제할 수 있는 첫 지점이 생각과 태도라는 점을 되새기기에는 강력한 책입니다.",
  "recommendedFor": [
    "짧지만 오래 곱씹을 고전을 찾는 사람",
    "생각 습관과 행동 결과의 연결을 점검하고 싶은 사람",
    "자기계발서를 기술보다 철학으로 읽고 싶은 사람"
  ],
  "relatedBookIds": ["how-to-stop-worrying-and-start-living", "atomic-habits"],
  "markdownPath": "markdown/as-a-man-thinketh.md",
  "createdAt": "2026-06-12T20:20:50+09:00",
  "updatedAt": "2026-06-12T20:20:50+09:00"
}
