{
  "id": "the-one-thing",
  "title": "원씽",
  "subtitle": "복잡한 세상을 이기는 단순함의 힘",
  "author": "게리 켈러, 제이 파파산",
  "publisher": "비즈니스북스",
  "publishedYear": 2013,
  "isbn": "9788997575169",
  "category": "self-improvement",
  "tags": ["집중", "우선순위", "생산성", "커리어"],
  "difficulty": "beginner",
  "estimatedReadMinutes": 10,
  "curatorScore": 88,
  "oneLine": "흩어진 목표를 한 가지 질문으로 압축하게 만드는 집중의 책",
  "whyRead": "40대에는 할 수 있는 일보다 하지 않을 일을 정하는 감각이 중요해진다. 이 책은 시간과 에너지를 가장 중요한 한 방향으로 모으는 기준을 준다.",
  "summary": [
    "큰 성과는 모든 일을 고르게 잘해서가 아니라 가장 중요한 일을 계속 밀어붙일 때 나온다.",
    "일과 삶의 영역마다 지금 가장 먼저 움직여야 할 단 하나를 질문하게 만든다.",
    "멀티태스킹의 매력보다 집중의 누적 효과가 더 크다는 점을 반복해서 확인시킨다.",
    "목표를 줄이면 행동이 명확해지고, 행동이 명확해지면 지속 가능성이 높아진다."
  ],
  "keyQuotes": [
    "중요한 일을 고르는 순간, 나머지 일의 우선순위도 함께 정리된다.",
    "집중은 더 많은 일을 해내는 기술이 아니라 덜 중요한 일을 내려놓는 결단이다."
  ],
  "curatorNote": "매일 아침 할 일 목록을 쓰기 전에 '오늘 하나만 성공한다면 무엇인가'를 먼저 적어보세요.",
  "recommendedFor": ["업무와 가정 사이에서 집중력이 분산되는 사람", "목표는 많은데 실행이 흐릿한 사람", "커리어 후반전의 우선순위를 다시 세우고 싶은 사람"],
  "relatedBookIds": ["atomic-habits", "deep-work"],
  "markdownPath": "markdown/the-one-thing.md",
  "createdAt": "2026-06-13T09:50:00+09:00",
  "updatedAt": "2026-06-13T09:50:00+09:00"
}
