{
  "id": "tidying-up",
  "title": "정리의 힘",
  "subtitle": "곤도 마리에 정리 시리즈 1",
  "author": "곤도 마리에",
  "publisher": "웅진지식하우스",
  "publishedYear": 2020,
  "isbn": "9788901234472",
  "category": "self-improvement",
  "tags": ["정리", "미니멀라이프", "생활", "습관", "공간"],
  "difficulty": "beginner",
  "estimatedReadMinutes": 12,
  "curatorScore": 92,
  "oneLine": "물건을 줄이는 기술을 넘어, 남길 것과 버릴 것을 결정하는 감각을 훈련시키는 책",
  "whyRead": "정리가 늘 실패하는 이유는 수납 기술이 부족해서가 아니라 판단 기준이 흐릿하기 때문이다. 이 책은 집 안의 물건을 매개로 삶의 우선순위를 다시 고르는 법을 알려준다.",
  "summary": [
    "정리는 청소가 아니라 결정의 과정이다.",
    "카테고리별로 한 번에 마주해야 반복적인 정리 피로가 줄어든다.",
    "남길 물건을 먼저 고르면 버리기는 덜 폭력적인 선택이 된다.",
    "물건의 자리가 정해질 때 생활의 에너지도 덜 새어나간다."
  ],
  "keyQuotes": [
    "집을 정리한다는 것은 결정을 미루던 시간을 회수하는 일이다.",
    "남기는 기준이 분명해질수록 삶의 우선순위도 선명해진다."
  ],
  "curatorNote": "RAYUL BOOKS 기준으로 이 책의 가치는 '버리는 법'보다 '판단하는 법'에 있습니다. 물건을 정리하는 책처럼 보이지만, 실제로는 내가 어떤 환경에서 집중하고 회복하는 사람인지 묻는 책입니다.",
  "recommendedFor": [
    "방과 책상이 늘 다시 어지러워지는 사람",
    "미니멀라이프를 감성보다 실행법으로 배우고 싶은 사람",
    "새 프로젝트를 시작하기 전 생활 환경을 가볍게 만들고 싶은 사람"
  ],
  "relatedBookIds": ["atomic-habits", "how-to-stop-worrying-and-start-living"],
  "markdownPath": "markdown/tidying-up.md",
  "createdAt": "2026-06-12T20:20:50+09:00",
  "updatedAt": "2026-06-12T20:20:50+09:00"
}
